{
  "$schema": "http://json-schema.org/draft-07/schema#",
  "$id": "https://kingin-yellows.dev/schemas/catalog-plugin.schema.json",
  "title": "Neutral Catalog Plugin Source Schema",
  "description": "Schema for catalog/plugins/<name>.json — shared plugin metadata, per-target enablement, and target-specific overrides that scripts/lib/generate/emit-claude.js and emit-codex.js read to build the generated Claude and Codex artifacts. Does not re-validate the full internal shape of pass-through Claude component fields (outputStyles, mcpServers, hooks, userConfig, dependencies) — schemas/plugin.schema.json already validates those exhaustively on the generated .claude-plugin/plugin.json output; this schema only guards the catalog-specific fields (marketplace, targets) that have no downstream re-check.",
  "$comment": "Repo-derived schema, not an official Anthropic or OpenAI schema. Target overrides are validated before generation. Codex local contracts were rechecked against pinned CLI 0.157.0 and its app-server protocol on October 6, 2026; see docs/research/codex-phases-2-5-2026-10-06/phase2.md. Runtime validity, presentation metadata and optional public submission requirements are separate. Only the catalog-selected Codex targets and skills are emitted.",
  "type": "object",
  "additionalProperties": false,
  "required": [
    "$schema",
    "description",
    "author",
    "homepage",
    "repository",
    "license",
    "keywords",
    "marketplace",
    "targets"
  ],
  "properties": {
    "$schema": {
      "type": "string",
      "format": "uri"
    },
    "description": {
      "type": "string",
      "minLength": 1
    },
    "author": {
      "type": "object",
      "additionalProperties": false,
      "required": ["name"],
      "properties": {
        "name": {
          "type": "string",
          "minLength": 1
        },
        "url": {
          "type": "string",
          "format": "uri"
        },
        "email": {
          "type": "string",
          "format": "email"
        }
      }
    },
    "homepage": {
      "type": "string",
      "format": "uri"
    },
    "repository": {
      "type": "string",
      "minLength": 1
    },
    "license": {
      "type": "string",
      "minLength": 1
    },
    "keywords": {
      "type": "array",
      "items": {
        "type": "string"
      }
    },
    "outputStyles": {
      "description": "Pass-through Claude component field; see schemas/plugin.schema.json for its full shape."
    },
    "mcpServers": {
      "description": "Pass-through Claude component field; see schemas/plugin.schema.json for its full shape."
    },
    "hooks": {
      "description": "Pass-through Claude component field; see schemas/plugin.schema.json for its full shape."
    },
    "userConfig": {
      "type": "object",
      "description": "Pass-through Claude component field; see schemas/plugin.schema.json for its full shape."
    },
    "dependencies": {
      "type": "array",
      "description": "Pass-through Claude component field; see schemas/plugin.schema.json for its full shape."
    },
    "capabilityProvider": {
      "type": "object",
      "additionalProperties": false,
      "required": ["group", "id"],
      "description": "Catalog-only declaration that this plugin is one interchangeable implementation of a capability group (e.g. the `stacked-pr` group, provided by either Graphite or GitHub native stacks). Both emitters build their manifests from explicit key lists, so this field is never written into .claude-plugin/plugin.json, .claude-plugin/marketplace.json, or .codex-plugin/plugin.json; scripts/validate-provider-groups.js pins that non-emission. Runtime mutual exclusion (exactly one provider enabled) is NOT expressible here — it is enforced by plugins/yellow-core/lib/stack-provider-state.js and its fixture tests.",
      "properties": {
        "group": {
          "type": "string",
          "minLength": 1,
          "pattern": "^[a-z0-9]+(-[a-z0-9]+)*$",
          "description": "Capability group slug. Every plugin sharing a group is an alternative implementation of the same capability; at most one may be enabled at runtime."
        },
        "id": {
          "type": "string",
          "minLength": 1,
          "pattern": "^[a-z0-9]+(-[a-z0-9]+)*$",
          "description": "Provider identity within the group. Must be unique across the group and is the token users type (e.g. `graphite`, `github`)."
        }
      }
    },
    "marketplace": {
      "type": "object",
      "additionalProperties": false,
      "required": ["category", "source"],
      "properties": {
        "description": {
          "type": "string",
          "description": "Overrides the top-level description in the generated marketplace entry when present."
        },
        "category": {
          "type": "string",
          "minLength": 1
        },
        "source": {
          "oneOf": [
            {
              "type": "string",
              "minLength": 1
            },
            {
              "type": "object",
              "additionalProperties": false,
              "required": ["source", "url"],
              "properties": {
                "source": {
                  "type": "string",
                  "const": "url"
                },
                "url": {
                  "type": "string",
                  "format": "uri"
                }
              }
            }
          ]
        }
      }
    },
    "targets": {
      "type": "object",
      "additionalProperties": false,
      "required": ["claude", "codex"],
      "properties": {
        "claude": {
          "type": "boolean",
          "description": "Claude-target enablement. Unlike targets.codex, this stays a bare boolean — the Claude emitter carries no per-plugin overrides."
        },
        "codex": {
          "type": "object",
          "additionalProperties": false,
          "required": ["enabled"],
          "allOf": [
            {
              "if": {
                "properties": {
                  "enabled": {
                    "const": true
                  }
                },
                "required": ["enabled"]
              },
              "then": {
                "required": ["interface"],
                "properties": {
                  "interface": true
                }
              }
            }
          ],
          "properties": {
            "enabled": {
              "type": "boolean"
            },
            "includeHooks": {
              "type": "boolean",
              "description": "Per-plugin opt-out for hook carryover into the generated Codex manifest (R20 default: true/unset carries the plugin's inline Claude hooks into hooks/codex-hooks.json). Set to false when a plugin's Codex exposure must exclude hooks it still needs on the Claude side (R22)."
            },
            "interface": {
              "type": "object",
              "additionalProperties": false,
              "required": ["displayName", "category"],
              "properties": {
                "displayName": {
                  "type": "string",
                  "minLength": 1
                },
                "category": {
                  "type": "string",
                  "minLength": 1
                }
              },
              "description": "Required once targets.codex.enabled is true (buildCodexPluginManifest dereferences both fields unconditionally); optional while enabled is false."
            },
            "description": {
              "type": "string",
              "minLength": 1,
              "description": "Overrides the top-level description in the generated Codex manifest when present."
            },
            "skillAllowlist": {
              "type": "array",
              "items": {
                "type": "string"
              },
              "description": "Skill directory names under skills/ that buildCodexSkillTree copies into plugins/<name>/codex/skills/. Skills not listed here are excluded from the Codex distribution (R7)."
            },
            "componentPaths": {
              "type": "object",
              "additionalProperties": false,
              "properties": {
                "skills": {
                  "type": "string",
                  "minLength": 1,
                  "description": "Manifest-relative path the generated Codex plugin manifest declares for its skill tree (R7: 'an explicit manifest-relative choice, not an assumed convention')."
                }
              }
            },
            "mcpServers": {
              "type": "object",
              "minProperties": 1,
              "propertyNames": {
                "pattern": "^[a-z][a-z0-9_-]*$"
              },
              "additionalProperties": {
                "type": "object",
                "additionalProperties": false,
                "required": ["url"],
                "properties": {
                  "url": {
                    "type": "string",
                    "pattern": "^https://[^@?#$\\s]+$"
                  },
                  "enabled_tools": {
                    "type": "array",
                    "minItems": 1,
                    "maxItems": 4,
                    "uniqueItems": true,
                    "items": {
                      "enum": [
                        "ask_wiki_question",
                        "ask_question",
                        "read_wiki_structure",
                        "read_wiki_contents"
                      ]
                    }
                  }
                }
              }
            }
          }
        },
        "cursor": {
          "type": "object",
          "additionalProperties": false,
          "required": ["enabled"],
          "allOf": [
            {
              "if": {
                "properties": {
                  "enabled": {
                    "const": true
                  }
                },
                "required": ["enabled"]
              },
              "then": {
                "required": ["interface"],
                "properties": {
                  "interface": true
                }
              }
            }
          ],
          "properties": {
            "enabled": {
              "type": "boolean"
            },
            "interface": {
              "type": "object",
              "additionalProperties": false,
              "required": ["displayName", "category"],
              "properties": {
                "displayName": {
                  "type": "string",
                  "minLength": 1
                },
                "category": {
                  "type": "string",
                  "minLength": 1
                }
              },
              "description": "Required once targets.cursor.enabled is true (buildCursorPluginManifest dereferences both fields unconditionally); optional while enabled is false. Flattened onto the generated .cursor-plugin/plugin.json's top-level displayName/category fields — the upstream Cursor manifest has no nested 'interface' object of its own (that nesting is a catalog-authoring convenience shared with targets.codex, not an emitted shape)."
            },
            "description": {
              "type": "string",
              "minLength": 1,
              "description": "Overrides the top-level description in the generated Cursor manifest when present."
            },
            "skillAllowlist": {
              "type": "array",
              "items": {
                "type": "string"
              },
              "description": "Skill directory names under skills/ that buildCursorSkillTree copies into plugins/<name>/cursor/skills/. Skills not listed here are excluded from the Cursor distribution."
            },
            "componentPaths": {
              "type": "object",
              "additionalProperties": false,
              "properties": {
                "skills": {
                  "type": "string",
                  "minLength": 1,
                  "description": "Manifest-relative path the generated Cursor plugin manifest declares for its skill tree."
                }
              }
            }
          },
          "description": "OPTIONAL, unlike targets.codex above (which is required on every plugin): absence means Cursor-disabled, matching isCursorEnabled's fail-closed Boolean(...) && enabled === true check — existing catalog sources do not need an explicit { enabled: false } entry."
        }
      }
    },
    "lifecycle": {
      "type": "object",
      "additionalProperties": false,
      "required": ["status"],
      "properties": {
        "status": {
          "type": "string",
          "enum": ["active", "experimental", "legacy", "deprecated"]
        },
        "installPolicy": {
          "type": "string",
          "enum": ["auto", "manual"]
        },
        "support": {
          "type": "string",
          "enum": ["full", "security-only"]
        },
        "replacement": {
          "type": "string",
          "pattern": "^[a-zA-Z0-9_-]+$",
          "description": "Names another catalog plugin (must exist in catalog.json's pluginOrder — checked by scripts/generate-manifests.js's validateLifecycle, not expressible in this static schema)."
        }
      },
      "description": "Catalog-only lifecycle metadata (e.g. marking a plugin legacy with a named replacement). Never emitted into any generated artifact (.claude-plugin/plugin.json, .codex-plugin/plugin.json, .cursor-plugin/plugin.json, or any marketplace file) — scripts/validate-cursor.js scans every generated artifact for a literal \"lifecycle\" key as a non-emission gate."
    }
  }
}
