{
  "$schema": "https://json.schemastore.org/claude-code-plugin-manifest.json",
  "description": "OpenAI Codex CLI wrapper with review, rescue, and analysis agents for workflow integration",
  "author": {
    "name": "KingInYellows",
    "url": "https://github.com/KingInYellows"
  },
  "homepage": "https://github.com/KingInYellows/yellow-plugins#yellow-codex",
  "repository": "https://github.com/KingInYellows/yellow-plugins",
  "license": "MIT",
  "keywords": ["codex", "openai", "code-review", "ai-agent", "rescue", "analysis"],
  "marketplace": {
    "category": "development",
    "source": "./plugins/yellow-codex"
  },
  "targets": {
    "claude": true,
    "codex": {
      "enabled": true,
      "interface": {
        "displayName": "Yellow Codex",
        "category": "development"
      },
      "skillAllowlist": ["codex-readiness"],
      "componentPaths": {
        "skills": "./codex/skills"
      },
      "includeHooks": false
    }
  }
}
