{
  "$schema": "https://json.schemastore.org/claude-code-plugin-manifest.json",
  "description": "yellow-goal engine bridge \u2014 probe a pinned goal-gen process, create/validate request packets, run zero-spend stub scenarios, and forward a user-only approval-gated real run. Never imports the engine.",
  "author": {
    "name": "KingInYellows",
    "url": "https://github.com/KingInYellows"
  },
  "homepage": "https://github.com/KingInYellows/yellow-plugins#yellow-goal",
  "repository": "https://github.com/KingInYellows/yellow-plugins",
  "license": "MIT",
  "keywords": ["yellow-goal", "goal-gen", "engine-bridge", "process-contract", "request-packet"],
  "marketplace": {
    "category": "development",
    "source": "./plugins/yellow-goal"
  },
  "targets": {
    "claude": true,
    "codex": {
      "enabled": false
    }
  },
  "dependencies": [
    {
      "name": "yellow-core",
      "version": "*",
      "optional": false,
      "reason": "goal:run-stub and goal:run-real source validate_file_path() from yellow-core/lib/validate-fs.sh to contain the request and approval paths; the commands fail closed without it"
    }
  ]
}
