{
  "$schema": "https://json.schemastore.org/claude-code-plugin-manifest.json",
  "description": "GitHub-native stacked-PR provider. Creates, submits, amends, syncs, navigates, cleans up, and merges stacks through a validated CLI adapter over the official github/gh-stack extension.",
  "author": {
    "name": "KingInYellows",
    "url": "https://github.com/KingInYellows"
  },
  "homepage": "https://github.com/KingInYellows/yellow-plugins/tree/main/plugins/github-workflow",
  "repository": "https://github.com/KingInYellows/yellow-plugins",
  "license": "MIT",
  "keywords": [
    "github",
    "gh-stack",
    "gh-cli",
    "stacked-prs",
    "pull-requests",
    "workflow",
    "provider"
  ],
  "dependencies": ["yellow-core"],
  "hooks": {
    "PreToolUse": [
      {
        "matcher": "Bash",
        "hooks": [
          {
            "type": "command",
            "command": "node \"${CLAUDE_PLUGIN_ROOT}/hooks/scripts/entrypoint-claude.js\" --hook check-git-push",
            "timeout": 5
          }
        ]
      }
    ],
    "PostToolUse": [
      {
        "matcher": "Bash",
        "hooks": [
          {
            "type": "command",
            "command": "node \"${CLAUDE_PLUGIN_ROOT}/hooks/scripts/entrypoint-claude.js\" --hook check-commit-message",
            "timeout": 5
          }
        ]
      }
    ]
  },
  "capabilityProvider": {
    "group": "stacked-pr",
    "id": "github"
  },
  "marketplace": {
    "description": "GitHub-native stacked-PR provider — full command surface (setup, status, plan, submit, amend, sync, nav, cleanup, merge)",
    "category": "development",
    "source": "./plugins/github-workflow"
  },
  "targets": {
    "claude": true,
    "codex": {
      "enabled": false
    }
  }
}
