{
  "$schema": "https://json.schemastore.org/claude-code-plugin-manifest.json",
  "description": "CI failure diagnosis, workflow linting, and runner health management for self-hosted GitHub Actions runners",
  "author": {
    "name": "KingInYellows",
    "url": "https://github.com/KingInYellows"
  },
  "homepage": "https://github.com/KingInYellows/yellow-plugins#yellow-ci",
  "repository": "https://github.com/KingInYellows/yellow-plugins",
  "license": "MIT",
  "keywords": [
    "ci",
    "github-actions",
    "self-hosted",
    "runner",
    "diagnosis"
  ],
  "hooks": {
    "SessionStart": [
      {
        "matcher": "*",
        "hooks": [
          {
            "type": "command",
            "command": "node \"${CLAUDE_PLUGIN_ROOT}/hooks/scripts/entrypoint-claude.js\"",
            "timeout": 3
          }
        ]
      }
    ]
  },
  "dependencies": [
    {
      "name": "yellow-linear",
      "version": "*",
      "optional": true,
      "reason": "ci:report-linear uses mcp__plugin_yellow-linear_linear__save_issue"
    }
  ],
  "marketplace": {
    "category": "development",
    "source": "./plugins/yellow-ci"
  },
  "targets": {
    "claude": true,
    "codex": {
      "enabled": true,
      "interface": {
        "displayName": "Yellow CI",
        "category": "Developer Tools"
      },
      "description": "CI failure diagnosis, GitHub Actions workflow linting, self-hosted runner setup and health skills, invoked as Codex skills. Read-mostly: SSH/config writes and workflow-lint fixes always preview and confirm first.",
      "skillAllowlist": [
        "ci-setup",
        "ci-setup-runner-targets",
        "ci-status",
        "ci-diagnose",
        "ci-lint-workflows",
        "ci-runner-health",
        "ci-conventions",
        "diagnose-ci"
      ],
      "componentPaths": {
        "skills": "./codex/skills"
      }
    }
  }
}
