{
  "$schema": "https://json.schemastore.org/claude-code-plugin-manifest.json",
  "description": "Local supervised delegate on the Antigravity CLI (agy) under the owner's Google AI Pro sign-in — successor to yellow-jules (scaffold: setup checks only)",
  "author": {
    "name": "KingInYellows",
    "url": "https://github.com/KingInYellows"
  },
  "homepage": "https://github.com/KingInYellows/yellow-plugins#yellow-agy",
  "repository": "https://github.com/KingInYellows/yellow-plugins",
  "license": "MIT",
  "keywords": ["antigravity", "agy", "google", "local-agent", "delegation", "ai-agent"],
  "marketplace": {
    "category": "development",
    "source": "./plugins/yellow-agy"
  },
  "targets": {
    "claude": true,
    "codex": {
      "enabled": false
    }
  },
  "lifecycle": {
    "status": "experimental",
    "installPolicy": "manual"
  }
}
