{
  "$schema": "https://json.schemastore.org/claude-code-plugin-manifest.json",
  "description": "Graphite-native workflow commands for stacked PR development. Provides smart commit-and-submit with parallel audit agents, stack planning, sync, and navigation — all through the gt CLI.",
  "author": {
    "name": "KingInYellows",
    "url": "https://github.com/KingInYellows"
  },
  "homepage": "https://github.com/KingInYellows/yellow-plugins/tree/main/plugins/gt-workflow",
  "repository": "https://github.com/KingInYellows/yellow-plugins",
  "license": "MIT",
  "keywords": [
    "graphite",
    "graphite-cli",
    "gt",
    "git",
    "stacked-prs",
    "smart-commits",
    "sync",
    "conventional-commits",
    "workflow",
    "pull-requests"
  ],
  "dependencies": ["yellow-core"],
  "outputStyles": "./output-styles",
  "mcpServers": "./.mcp.json",
  "hooks": {
    "PreToolUse": [
      {
        "matcher": "Bash",
        "hooks": [
          {
            "type": "command",
            "command": "node \"${CLAUDE_PLUGIN_ROOT}/hooks/scripts/entrypoint-claude.js\" --hook check-git-push",
            "timeout": 5
          }
        ]
      }
    ],
    "PostToolUse": [
      {
        "matcher": "Bash",
        "hooks": [
          {
            "type": "command",
            "command": "node \"${CLAUDE_PLUGIN_ROOT}/hooks/scripts/entrypoint-claude.js\" --hook check-commit-message",
            "timeout": 5
          }
        ]
      }
    ]
  },
  "capabilityProvider": {
    "group": "stacked-pr",
    "id": "graphite"
  },
  "marketplace": {
    "description": "Graphite-native workflow commands for stacked PRs, smart commits, sync, and stack navigation",
    "category": "development",
    "source": "./plugins/gt-workflow"
  },
  "targets": {
    "claude": true,
    "codex": {
      "enabled": true,
      "interface": {
        "displayName": "Graphite Workflow",
        "category": "Developer Tools"
      },
      "description": "Graphite-native workflow skills for stacked PR development — commit auditing, stack planning, sync, and navigation, invoked as Codex skills through the gt CLI.",
      "skillAllowlist": [
        "gt-setup",
        "gt-nav",
        "gt-stack-plan",
        "gt-sync",
        "smart-submit",
        "gt-amend",
        "gt-cleanup",
        "audit-review",
        "stack-decomposition-format",
        "stack-plan-style",
        "gt-merge"
      ],
      "componentPaths": {
        "skills": "./codex/skills"
      }
    }
  }
}
